[
  {
    "id": 1,
    "name": "O'ng qo'l qoidasi",
    "band": "base",
    "junction": "cross",
    "arms": [
      {
        "dir": "N",
        "sign": "none",
        "queue": []
      },
      {
        "dir": "E",
        "sign": "none",
        "queue": [
          {
            "kind": "car",
            "turn": "straight"
          }
        ]
      },
      {
        "dir": "S",
        "sign": "none",
        "queue": [
          {
            "kind": "car",
            "turn": "straight"
          }
        ]
      },
      {
        "dir": "W",
        "sign": "none",
        "queue": []
      }
    ],
    "intro": {
      "title": "1-dars: O'ng qo'l qoidasi",
      "text": "Belgisiz (teng ahamiyatli) chorrahada har bir haydovchi O'NG tomonidan kelayotgan mashinaga yo'l beradi. Qaysi mashinaning o'ng tomoni bo'sh bo'lsa — o'sha birinchi o'tadi. Mashinani bosing!"
    },
    "tip": "Janubdagi mashinaning o'ng tomonida sharqdagi mashina turibdi — avval o'shani yuboring.",
    "coach": [
      {
        "vehicle": "E0",
        "text": "Sharqdan kelayotgan mashinaning o'ng tomoni bo'sh — u birinchi o'tadi. Uni bosing!"
      },
      {
        "vehicle": "S0",
        "text": "Endi janubdagi mashinaning o'ng tomoni bo'shadi. Yo'l ochiq — yuboring."
      }
    ],
    "parMs": 5500
  },
  {
    "id": 2,
    "name": "Kim birinchi?",
    "band": "base",
    "junction": "cross",
    "arms": [
      {
        "dir": "N",
        "sign": "none",
        "queue": []
      },
      {
        "dir": "E",
        "sign": "none",
        "queue": [
          {
            "kind": "car",
            "turn": "straight"
          }
        ]
      },
      {
        "dir": "S",
        "sign": "none",
        "queue": [
          {
            "kind": "car",
            "turn": "straight"
          }
        ]
      },
      {
        "dir": "W",
        "sign": "none",
        "queue": [
          {
            "kind": "car",
            "turn": "straight"
          }
        ]
      }
    ],
    "intro": {
      "title": "2-dars: Zanjir",
      "text": "Uchta mashina — har biri o'ngdagisini kutadi. Zanjirning boshini toping: o'ng tomoni bo'sh mashina."
    },
    "tip": "Sharqdagi mashinaning o'ng tomoni bo'sh. Keyin janubdagi, oxirida g'arbdagi.",
    "coach": [
      {
        "vehicle": "E0",
        "text": "Zanjir boshi: sharqdagi mashinaning o'ngida hech kim yo'q."
      },
      {
        "vehicle": "S0",
        "text": "Janubdagi mashina sharqdagini kutgan edi. Endi uning navbati."
      },
      {
        "vehicle": "W0",
        "text": "G'arbdagi mashina janubdagini kutdi. Oxirgisini yuboring."
      }
    ],
    "parMs": 6500
  },
  {
    "id": 3,
    "name": "Chapga burilish",
    "band": "base",
    "junction": "cross",
    "arms": [
      {
        "dir": "N",
        "sign": "none",
        "queue": [
          {
            "kind": "car",
            "turn": "straight"
          }
        ]
      },
      {
        "dir": "E",
        "sign": "none",
        "queue": [
          {
            "kind": "car",
            "turn": "right"
          }
        ]
      },
      {
        "dir": "S",
        "sign": "none",
        "queue": [
          {
            "kind": "car",
            "turn": "left"
          }
        ]
      },
      {
        "dir": "W",
        "sign": "none",
        "queue": []
      }
    ],
    "intro": {
      "title": "3-dars: Chapga burilish",
      "text": "Chapga burilayotgan mashina QARSHIDAN to'g'riga yoki o'ngga ketayotgan mashinaga yo'l beradi. O'ngga burilish ko'pincha hech kimga xalaqit bermaydi."
    },
    "tip": "Janubdagi mashina chapga buriladi — qarshidagi (shimoldagi) to'g'riga ketuvchini kutadi.",
    "coach": [
      {
        "vehicle": "E0",
        "text": "O'ngga burilayotgan mashina hech kimning yo'lini kesmaydi — bemalol yuboring."
      },
      {
        "vehicle": "N0",
        "text": "Shimoldagi mashina to'g'riga ketadi, uning o'ng tomoni bo'sh."
      },
      {
        "vehicle": "S0",
        "text": "Chapga buriluvchi qarshidan kelgan mashinani kutdi. Endi o'tishi mumkin."
      }
    ],
    "parMs": 5500
  },
  {
    "id": 4,
    "name": "Tartib zanjiri",
    "band": "base",
    "junction": "cross",
    "arms": [
      {
        "dir": "N",
        "sign": "none",
        "queue": [
          {
            "kind": "car",
            "turn": "straight"
          }
        ]
      },
      {
        "dir": "E",
        "sign": "none",
        "queue": [
          {
            "kind": "car",
            "turn": "right"
          }
        ]
      },
      {
        "dir": "S",
        "sign": "none",
        "queue": [
          {
            "kind": "car",
            "turn": "left"
          }
        ]
      },
      {
        "dir": "W",
        "sign": "none",
        "queue": [
          {
            "kind": "car",
            "turn": "right"
          }
        ]
      }
    ],
    "tip": "Shimoldagi mashina o'ngidagi (g'arbdagi) mashinani kutadi, janubdagi esa shimoldagini.",
    "parMs": 7000
  },
  {
    "id": 5,
    "name": "Tez yordam!",
    "band": "base",
    "junction": "cross",
    "arms": [
      {
        "dir": "N",
        "sign": "none",
        "queue": []
      },
      {
        "dir": "E",
        "sign": "none",
        "queue": [
          {
            "kind": "car",
            "turn": "straight"
          }
        ]
      },
      {
        "dir": "S",
        "sign": "none",
        "queue": [
          {
            "kind": "ambulance",
            "turn": "straight"
          }
        ]
      },
      {
        "dir": "W",
        "sign": "none",
        "queue": [
          {
            "kind": "car",
            "turn": "left"
          }
        ]
      }
    ],
    "intro": {
      "title": "5-dars: Maxsus transport",
      "text": "Chiroqlari yonib, sirena chalayotgan tez yordam va o't o'chirish mashinalari DOIMO ustun. Ularni birinchi navbatda yuboring — qolganlar kutadi."
    },
    "tip": "Avval tez yordam, keyin sharqdagi, oxirida chapga buriluvchi.",
    "coach": [
      {
        "vehicle": "S0",
        "text": "Tez yordam — doimo birinchi! Sirenali mashinani yuboring."
      },
      {
        "vehicle": "E0",
        "text": "Sharqdagi mashinaning o'ng tomoni bo'sh."
      },
      {
        "vehicle": "W0",
        "text": "Chapga buriluvchi qarshidagi mashinani kutdi — endi uning navbati."
      }
    ],
    "parMs": 7500
  },
  {
    "id": 6,
    "name": "Navbat",
    "band": "base",
    "junction": "cross",
    "arms": [
      {
        "dir": "N",
        "sign": "none",
        "queue": []
      },
      {
        "dir": "E",
        "sign": "none",
        "queue": [
          {
            "kind": "car",
            "turn": "straight"
          }
        ]
      },
      {
        "dir": "S",
        "sign": "none",
        "queue": [
          {
            "kind": "car",
            "turn": "right"
          },
          {
            "kind": "car",
            "turn": "straight"
          }
        ]
      },
      {
        "dir": "W",
        "sign": "none",
        "queue": [
          {
            "kind": "car",
            "turn": "left"
          }
        ]
      }
    ],
    "intro": {
      "title": "6-dars: Navbat",
      "text": "Bir yo'lda bir nechta mashina bo'lsa, faqat stop-chiziqdagi birinchisi harakatlana oladi. Orqadagini bosish hech narsa qilmaydi — jazo ham yo'q."
    },
    "parMs": 7000
  },
  {
    "id": 7,
    "name": "Chilonzor chorrahasi",
    "band": "base",
    "junction": "cross",
    "arms": [
      {
        "dir": "N",
        "queue": [
          {
            "kind": "car",
            "turn": "right"
          }
        ]
      },
      {
        "dir": "E",
        "queue": [
          {
            "kind": "car",
            "turn": "left"
          }
        ]
      },
      {
        "dir": "S",
        "queue": [
          {
            "kind": "car",
            "turn": "left"
          },
          {
            "kind": "taxi",
            "turn": "left"
          }
        ]
      },
      {
        "dir": "W",
        "queue": [
          {
            "kind": "car",
            "turn": "straight"
          },
          {
            "kind": "car",
            "turn": "left"
          }
        ]
      }
    ],
    "tip": "O'ng tomonni tekshiring: o'ngdan kelayotgan mashina ustun. Chapga buriluvchi qarshidagini kutadi.",
    "parMs": 10000
  },
  {
    "id": 8,
    "name": "Tiqilinch",
    "band": "base",
    "junction": "cross",
    "arms": [
      {
        "dir": "N",
        "sign": "none",
        "queue": [
          {
            "kind": "car",
            "turn": "straight"
          },
          {
            "kind": "car",
            "turn": "right"
          }
        ]
      },
      {
        "dir": "E",
        "sign": "none",
        "queue": [
          {
            "kind": "car",
            "turn": "straight"
          }
        ]
      },
      {
        "dir": "S",
        "sign": "none",
        "queue": [
          {
            "kind": "car",
            "turn": "straight"
          },
          {
            "kind": "car",
            "turn": "left"
          }
        ]
      },
      {
        "dir": "W",
        "sign": "none",
        "queue": [
          {
            "kind": "car",
            "turn": "straight"
          }
        ]
      }
    ],
    "intro": {
      "title": "8-dars: Tiqilinch",
      "text": "To'rtta mashina — har birining o'ngida boshqasi. Hech kim ustun emas! Bunday holatda haydovchilar kelishib o'tadi: istalgan bittasini yuboring, zanjir o'zi yechiladi."
    },
    "ambience": "evening",
    "parMs": 10000
  },
  {
    "id": 9,
    "name": "Sirena ovozi",
    "band": "base",
    "junction": "cross",
    "arms": [
      {
        "dir": "N",
        "queue": [
          {
            "kind": "truck",
            "turn": "left"
          },
          {